{
  "$schema": "https://json-schema.org/draft/2020-12/schema",
  "$id": "tenra-align.alignment-snapshot.v1",
  "title": "Align snapshot",
  "type": "object",
  "additionalProperties": true,
  "required": [
    "schema",
    "exportedAt",
    "sourceApp",
    "provider",
    "connectionStatus",
    "subject",
    "snapshot",
    "handoff"
  ],
  "properties": {
    "schema": {
      "const": "tenra-align.alignment-snapshot.v1",
      "type": "string"
    },
    "exportedAt": {
      "type": "string"
    },
    "sourceApp": {
      "type": "string"
    },
    "provider": {
      "type": "string"
    },
    "connectionStatus": {
      "type": "string"
    },
    "subject": {
      "type": "object"
    },
    "snapshot": {
      "type": "object"
    },
    "handoff": {
      "type": "object"
    }
  },
  "x-tenra": {
    "ownerApp": "align",
    "producerApp": "align",
    "consumerApps": [
      "suite review surfaces"
    ],
    "fixture": "tenra Align/fixtures/handoffs/alignment-snapshot.json",
    "correlationFields": [
      "subject.id"
    ],
    "standardControls": [
      "schema badge",
      "copy payload",
      "download JSON",
      "history"
    ]
  }
}
