{
  "schema": "tenra-align.alignment-snapshot.v1",
  "exportedAt": "2026-05-06T17:30:00.000Z",
  "sourceApp": "align",
  "provider": "mock",
  "connectionStatus": "mock",
  "subject": {
    "accountIds": [
      "acct-northstar"
    ],
    "locationIds": [
      "loc-northstar-midtown"
    ],
    "selectedLocationId": "loc-northstar-midtown"
  },
  "snapshot": {
    "accounts": [
      {
        "id": "acct-northstar",
        "providerAccountId": "accounts/1001",
        "displayName": "Northstar Dental Group",
        "organizationName": "Northstar Dental Group",
        "connectionStatus": "mock",
        "locationCount": 1,
        "lastSyncedAt": "2026-05-03T18:10:00.000Z"
      }
    ],
    "locations": [
      {
        "id": "loc-northstar-midtown",
        "accountId": "acct-northstar",
        "providerLocationId": "locations/2001",
        "displayName": "Northstar Dental - Midtown",
        "primaryCategory": "Dentist",
        "address": "210 W 31st St, New York, NY 10001",
        "phone": "+1 212-555-0134",
        "websiteUrl": "https://northstar.example/midtown",
        "verificationStatus": "verified",
        "profileHealthScore": 92,
        "reviewCount": 184,
        "averageRating": 4.7,
        "lastSyncedAt": "2026-05-03T18:09:00.000Z"
      }
    ],
    "profiles": [
      {
        "locationId": "loc-northstar-midtown",
        "businessName": "Northstar Dental - Midtown",
        "categories": [
          "Dentist",
          "Emergency Dental Service"
        ],
        "address": "210 W 31st St, New York, NY 10001",
        "phone": "+1 212-555-0134",
        "websiteUrl": "https://northstar.example/midtown",
        "hours": {
          "Monday": "08:00-18:00"
        },
        "serviceAreas": [
          "Midtown Manhattan"
        ],
        "attributes": [
          "Appointment required"
        ],
        "completenessScore": 92,
        "lastSyncedAt": "2026-05-03T18:09:00.000Z",
        "fields": [
          {
            "field": "phone",
            "label": "Phone",
            "status": "complete",
            "currentValue": "+1 212-555-0134",
            "lastCheckedAt": "2026-05-03T18:09:00.000Z"
          }
        ]
      }
    ],
    "reviews": [
      {
        "id": "review-demo",
        "locationId": "loc-northstar-midtown",
        "authorName": "Avery J.",
        "rating": 5,
        "comment": "Helpful front desk and clear follow-up.",
        "createdAt": "2026-05-01T15:00:00.000Z",
        "status": "needs_reply",
        "sentiment": "positive"
      }
    ],
    "performanceSummaries": [
      {
        "locationId": "loc-northstar-midtown",
        "periodStart": "2026-04-01",
        "periodEnd": "2026-04-30",
        "profileViews": 3400,
        "searchAppearances": 12500,
        "websiteClicks": 420,
        "phoneCalls": 88,
        "directionRequests": 133,
        "reviewCount": 9,
        "averageRating": 4.7,
        "trends": [
          {
            "label": "Website clicks",
            "value": 8,
            "direction": "up"
          }
        ]
      }
    ],
    "syncIssues": [
      {
        "id": "issue-demo",
        "accountId": "acct-northstar",
        "locationId": "loc-northstar-midtown",
        "severity": "warning",
        "type": "stale_data",
        "title": "Holiday hours need review",
        "description": "Holiday hours have not been confirmed for the next holiday period.",
        "field": "holidayHours",
        "detectedAt": "2026-05-03T18:09:00.000Z",
        "status": "open",
        "recommendedAction": "Confirm upcoming holiday hours before publishing updates."
      }
    ]
  },
  "handoff": {
    "summary": "Alignment snapshot for Northstar Dental - Midtown: 1 open issue(s), 1 review(s) needing reply.",
    "recommendedConsumers": [
      "registry",
      "assembly",
      "proxy",
      "sentinel"
    ],
    "openIssueCount": 1,
    "needsReplyCount": 1,
    "writePosture": "read-only"
  }
}
